{
  "admission": {
    "condition": "current-literal-true"
  },
  "admits_symbol": "tax.us.2025.f1099b.covered-lt-proceeds-subtotal",
  "closure_fact_type": {
    "id": "tax.us.2025.f1099b.covered-lt-proceeds.source-closure",
    "version": "v1"
  },
  "closure_horizon_key": "family-horizon",
  "closure_question": "Have you recorded the sale proceeds of every covered long-term sale on every Form 1099-B you or your spouse received for 2025?",
  "family": {
    "id": "tax.us.2025.f1099b.covered-lt-proceeds",
    "version": "v1"
  },
  "id": "tax.us.2025.closure-mapping.f1099b-covered-lt-proceeds",
  "member_fact_type": {
    "id": "tax.us.2025.f1099b.covered-lt-txn.proceeds",
    "version": "v1"
  },
  "schema": "source-closure-mapping.v3",
  "version": "v2"
}
