{
  "admission": {
    "condition": "current-literal-true"
  },
  "admits_symbol": "tax.us.2025.f1099b.covered-w-lt-adjustment-subtotal",
  "closure_fact_type": {
    "id": "tax.us.2025.f1099b.covered-w-lt-adjustment.source-closure",
    "version": "v1"
  },
  "closure_horizon_key": "family-horizon",
  "closure_question": "Have you recorded the wash-sale loss adjustment amount (a loss disallowed because you bought the same investment within 30 days before or after the sale) of every covered long-term sale on every Form 1099-B you or your spouse received for 2025?",
  "family": {
    "id": "tax.us.2025.f1099b.covered-w-lt-adjustment",
    "version": "v2"
  },
  "id": "tax.us.2025.closure-mapping.f1099b-covered-w-lt-adjustment",
  "member_fact_type": {
    "id": "tax.us.2025.f1099b.covered-w-lt-txn.adjustment",
    "version": "v1"
  },
  "schema": "source-closure-mapping.v3",
  "version": "v3"
}
